date,purpose,officer,division,docs,status,notes
2025-03-10,ยื่นคำขอจดทะเบียนอาหาร (แบบ อ.1),น.ส.สุพรรณี รัตนะ,กองอาหาร,"แบบ อ.1, สำเนาบัตร ปชช., หนังสือรับรองบริษัท",Completed,ได้รับเลข อย. เรียบร้อย
2025-04-22,ยื่นต่ออายุทะเบียนเครื่องสำอาง,นาย ธนวิทย์ สมใจ,กองเครื่องสำอาง,"แบบ คส.4, ฉลากสินค้า, COA",Completed,
2025-06-05,ขอแก้ไขฉลากอาหาร,น.ส.วรรณา ทองดี,กองอาหาร,"แบบ อ.7, ฉลากใหม่",Pending,รอเจ้าหน้าที่ตรวจสอบเอกสาร
2025-07-15,ยื่นคำขออนุญาตนำเข้าอาหาร,-,กองด่านอาหารและยา,"Invoice, Packing List, Certificate of Analysis",Upcoming,นัดหมายเวลา 10:00 น.
2025-08-01,สอบถามสถานะทะเบียนยา,นาย ประเสริฐ มั่นคง,กองยา,-,Completed,ได้รับเลขที่ใบสำคัญการขึ้นทะเบียนยา
2025-09-20,ยื่นคำขอใบอนุญาตผลิตอาหาร,-,กองอาหาร,"แบบ สบ.1, แผนผังโรงงาน",Upcoming,
